{
  "version": "1",
  "domain": "sdk",
  "category": "script",
  "description": "BIP276 network and version fields are 2-digit hex values (00–FF). The go-sdk pre-fix used a regex pattern '\\d{2}' that only matched decimal digits [0-9], rejecting any BIP276 string whose network or version byte contained a hex letter (A-F). Additionally, parsing used strconv.Atoi() (base-10) instead of ParseInt(base-16), and the network/version struct fields were assigned in reverse order.",
  "regression": {
    "issue": "go-sdk#286",
    "fixed_in": { "go": "v1.2.19" },
    "symptom": "DecodeBIP276 returned a regex mismatch error for any BIP276 string with hex digits A-F in the network or version position (e.g. network=0xFF, version=0xAA)",
    "root_cause": "Three bugs: (1) regex used \\d{2} instead of [0-9A-Fa-f]{2}; (2) strconv.Atoi used instead of ParseInt(s, 16, 64); (3) network and version struct fields assigned in reversed order"
  },
  "vectors": [
    {
      "id": "regression.bip276.hex-decode.0001",
      "description": "Decode BIP276 with network=0xFF (255) — must not reject hex letter 'f'",
      "parity_class": "intended",
      "input": {
        "operation": "DecodeBIP276",
        "bip276_string": "bitcoin-script:ff01737472696e67ad3ca5e1"
      },
      "expected": {
        "prefix": "bitcoin-script",
        "network": 255,
        "version": 1,
        "data_hex": "737472696e67",
        "decode_succeeds": true
      },
      "notes": "network=0xFF (first 2 hex chars after colon), version=0x01. Pre-fix regex rejected 'ff' because \\d{2} does not match hex letters. Checksum 'ad3ca5e1' is illustrative — implementations must verify the real checksum from EncodeBIP276."
    },
    {
      "id": "regression.bip276.hex-decode.0002",
      "description": "Decode BIP276 with version=0xAA (170) — must parse 'aa' as hex 170 not fail",
      "parity_class": "intended",
      "input": {
        "operation": "DecodeBIP276",
        "bip276_string": "bitcoin-script:01aa737472696e67b1e2c3d4"
      },
      "expected": {
        "prefix": "bitcoin-script",
        "network": 1,
        "version": 170,
        "data_hex": "737472696e67",
        "decode_succeeds": true
      },
      "notes": "version=0xAA (second 2 hex chars). Pre-fix: (1) regex rejected 'aa'; (2) even if accepted, Atoi('aa') would panic; (3) fields would be swapped. Marked intended: Go-SDK-only bug, TS SDK does not implement BIP276 in the same module."
    },
    {
      "id": "regression.bip276.hex-decode.0003",
      "description": "Encode then decode round-trip for network=0x01, version=0x01 (all decimal digits) must succeed",
      "parity_class": "intended",
      "input": {
        "operation": "EncodeBIP276_then_Decode",
        "prefix": "bitcoin-script",
        "network": 1,
        "version": 1,
        "data_hex": "737472696e67"
      },
      "expected": {
        "round_trip_network": 1,
        "round_trip_version": 1,
        "round_trip_data_hex": "737472696e67"
      },
      "notes": "Control case: all-numeric hex values must survive round-trip even after the regex fix. This was working before the fix and must remain so."
    }
  ]
}
